{
  "$schema": "https://json-schema.org/draft/2020-12/schema",
  "$id": "result-v1.schema.json",
  "type": "object",
  "required": [
    "plugin",
    "status",
    "summary",
    "metrics",
    "warnings",
    "provenance"
  ],
  "properties": {
    "plugin": {
      "type": "object",
      "required": [
        "name",
        "version",
        "schema_version"
      ],
      "properties": {
        "name": {
          "type": "string"
        },
        "version": {
          "type": "string"
        },
        "schema_version": {
          "type": "string",
          "enum": [
            "result-v1"
          ]
        },
        "git_commit": {
          "type": "string"
        }
      },
      "additionalProperties": false
    },
    "status": {
      "type": "string",
      "enum": [
        "success",
        "failed"
      ]
    },
    "summary": {
      "type": "string"
    },
    "metrics": {
      "type": "array",
      "items": {
        "type": "object",
        "required": [
          "name",
          "value"
        ],
        "properties": {
          "name": {
            "type": "string"
          },
          "value": {},
          "unit": {
            "type": "string"
          },
          "description": {
            "type": "string"
          }
        },
        "additionalProperties": false
      }
    },
    "tables": {
      "type": "array",
      "items": {
        "type": "object",
        "additionalProperties": true
      }
    },
    "charts": {
      "type": "array",
      "items": {
        "type": "object",
        "additionalProperties": true
      }
    },
    "highlights": {
      "type": "array",
      "items": {
        "type": "object",
        "additionalProperties": true
      }
    },
    "anomalies": {
      "type": "array",
      "items": {
        "type": "object",
        "additionalProperties": true
      }
    },
    "data_quality": {
      "type": "object",
      "additionalProperties": true
    },
    "notes": {
      "type": "array",
      "items": {
        "type": "string"
      }
    },
    "warnings": {
      "type": "array",
      "items": {
        "type": "string"
      }
    },
    "error": {
      "type": "object",
      "properties": {
        "message": {
          "type": "string"
        },
        "stacktrace": {
          "type": "string"
        },
        "retryable": {
          "type": "boolean"
        }
      },
      "additionalProperties": true
    },
    "provenance": {
      "type": "object",
      "required": [
        "run_id",
        "dataset_hash",
        "params",
        "started_at",
        "duration_ms",
        "environment"
      ],
      "properties": {
        "run_id": {
          "type": "string"
        },
        "dataset_hash": {
          "type": "string"
        },
        "params": {
          "type": "object",
          "additionalProperties": true
        },
        "started_at": {
          "type": "string"
        },
        "duration_ms": {
          "type": "integer",
          "minimum": 0
        },
        "environment": {
          "type": "object",
          "additionalProperties": true
        }
      },
      "additionalProperties": false
    }
  },
  "additionalProperties": false
}