{
  "plugin": {
    "name": "basic_stats",
    "version": "0.1.0",
    "schema_version": "result-v1"
  },
  "status": "success",
  "summary": "数据集共 12345 行，关键字段缺失率最高为 0.82（imei）。",
  "metrics": [
    {
      "name": "rows.total",
      "value": 12345,
      "unit": "rows"
    },
    {
      "name": "columns.count",
      "value": 56,
      "unit": "cols"
    }
  ],
  "tables": [
    {
      "name": "missing_rate_top",
      "title": "缺失率 Top 10",
      "columns": [
        {
          "name": "column",
          "type": "string"
        },
        {
          "name": "missing_rate",
          "type": "float64"
        }
      ],
      "rows_preview": [
        {
          "column": "imei",
          "missing_rate": 0.82
        }
      ],
      "artifact": "artifacts/tables/missing_rate_top.csv",
      "row_count": 10
    }
  ],
  "warnings": [],
  "provenance": {
    "run_id": "run_20260123_170000Z",
    "dataset_hash": "sha256:EXAMPLE",
    "params": {
      "top_k": 20
    },
    "started_at": "2026-01-23T17:00:00Z",
    "duration_ms": 1200,
    "environment": {
      "python": "3.11.7"
    }
  }
}